{
  "schema_version":"private-first-interview-conversion-board-v1","artifact_kind":"private_first_interview_conversion_board","locale":"es","as_of_date":"2026-08-26",
  "source_group":{"group_id":"group-synthetic-platform-review","source_snapshot":"snap-private-first-interview-v1-sha256-0000000000000000000000000000000000000000000000000000000000000000","recruiter_outreach_lab":{"record_id":"src-outreach-lab","state":"ready","objective":"Preparar una entrevista","fact_summary":"Hechos sintéticos"},"quality_gate":{"record_id":"src-quality-gate","state":"pass","checks":[{"check_id":"src-check-specificity","topic":"specificity","state":"pass"},{"check_id":"src-check-evidence","topic":"evidence","state":"pass"},{"check_id":"src-check-boundary","topic":"boundary","state":"pass"}]},"first_interview_7_day_plan":{"record_id":"src-seven-day-plan","state":"ready","objective":"Preparar siete días","fact_summary":"Puntos privados"},"weekly_coach_plan":{"record_id":"src-weekly-plan","state":"ready","objective":"Revisar señales","fact_summary":"Cadencia privada"},"decision_ladder":[{"branch":"advance","trigger":"Contexto confirmado","evidence":"Señal observable"},{"branch":"clarify","trigger":"Falta contexto","evidence":"Pendiente nombrado"},{"branch":"pause","trigger":"Señal débil","evidence":"Sin cambio"},{"branch":"stop","trigger":"Falla límite","evidence":"Restricción registrada"}],"plan_days":[{"day":1,"action":"Revisar contexto","signal":"Contexto claro"},{"day":2,"action":"Elegir evidencia","signal":"Límite claro"},{"day":3,"action":"Ensayar respuesta","signal":"Estructura estable"},{"day":4,"action":"Revisar límites","signal":"Pendientes visibles"},{"day":5,"action":"Redactar pregunta","signal":"Pregunta concreta"},{"day":6,"action":"Revisar ramas","signal":"Rama segura"},{"day":7,"action":"Revisión final","signal":"Límite explícito"}],"daily_review_logs":[{"day":1,"observed_signal":"Contexto revisado","question":"¿Qué falta?"},{"day":2,"observed_signal":"Evidencia elegida","question":"¿Qué la apoya?"},{"day":3,"observed_signal":"Respuesta ensayada","question":"¿Qué es seguro?"},{"day":4,"observed_signal":"Límites revisados","question":"¿Qué confirmar?"},{"day":5,"observed_signal":"Pregunta lista","question":"¿Es útil?"},{"day":6,"observed_signal":"Rama revisada","question":"¿Qué evidencia hay?"},{"day":7,"observed_signal":"Revisión final","question":"¿Límite intacto?"}]},
  "decision":[{"state":"ready","objective":"Preparar una entrevista","current_state":"Preparación privada lista","next_safe_action":"Revisar y ensayar","signal":"Contexto y hechos presentes","boundary":"No envía, agenda, aplica ni garantiza resultados"}],
  "sequence":[{"stage":"current_state","label":"Estado actual","description":"Identificar lo conocido"},{"stage":"private_preparation","label":"Preparación privada","description":"Preparar evidencia"},{"stage":"human_review","label":"Revisión humana","description":"Revisar señales"},{"stage":"authorization_gate","label":"Límite de autorización","description":"Mantener acciones externas desactivadas"}],
  "proof_cards":[{"vacancy_signal":"Responsabilidad operativa","evidence_summary":"Un hecho apoyado puede explicarse","caveat":"Revisar el alcance"}],
  "risk_checks":[{"topic":"production","trigger_question":"¿Está claro el alcance?","safe_response_boundary":"Describir solo hechos","confirmation_needed":"Confirmar alcance","forbidden_claim":"No afirmar responsabilidad no apoyada"},{"topic":"compensation","trigger_question":"¿Se conoce compensación?","safe_response_boundary":"Mantener valores desconocidos","confirmation_needed":"Confirmar antes de decidir","forbidden_claim":"No inferir compensación"},{"topic":"eligibility","trigger_question":"¿Está confirmada elegibilidad?","safe_response_boundary":"Tratar lo desconocido como tal","confirmation_needed":"Revisión humana","forbidden_claim":"No afirmar elegibilidad"},{"topic":"availability","trigger_question":"¿Está confirmada disponibilidad?","safe_response_boundary":"Indicar solo ventana revisada","confirmation_needed":"Confirmar horario","forbidden_claim":"No prometer disponibilidad"},{"topic":"confidentiality","trigger_question":"¿Expone material privado?","safe_response_boundary":"Usar evidencia abstracta","confirmation_needed":"Revisar límite","forbidden_claim":"No divulgar texto fuente"}],
  "rehearsal":{"question":"¿Cómo explicarías una decisión apoyada?","purpose":"Revisar claridad","response_structure":"Contexto, acción, resultado, límite","wait_boundary":"Esperar revisión humana","pre_response_score":"unknown"},
  "week":[{"day":1,"private_action":"Revisar contexto","evidence_boundary":"Solo hechos acotados","review_checkpoint":"Nombrar un pendiente","observable_signal":"Contexto claro","fallback":"Aclarar contexto","stop_rule":"Detener ante fuente no apoyada"},{"day":2,"private_action":"Elegir evidencia","evidence_boundary":"No ampliar el hecho","review_checkpoint":"Revisar alcance","observable_signal":"Límite claro","fallback":"Sin evidencia","stop_rule":"Detener sin apoyo"},{"day":3,"private_action":"Ensayar respuesta","evidence_boundary":"Respuesta ligada a fuente","review_checkpoint":"Revisar estructura","observable_signal":"Respuesta estable","fallback":"Acortar respuesta","stop_rule":"Detener ante invención"},{"day":4,"private_action":"Revisar límites","evidence_boundary":"Mantener pendientes","review_checkpoint":"Listar confirmaciones","observable_signal":"Pendientes visibles","fallback":"Pausar","stop_rule":"Detener ante restricción crítica"},{"day":5,"private_action":"Redactar pregunta","evidence_boundary":"Sin texto privado","review_checkpoint":"Revisar utilidad","observable_signal":"Pregunta concreta","fallback":"Deferir pregunta","stop_rule":"Detener ante divulgación"},{"day":6,"private_action":"Revisar ramas","evidence_boundary":"Sin predicciones","review_checkpoint":"Elegir rama segura","observable_signal":"Rama basada en evidencia","fallback":"Pausar","stop_rule":"Detener sin apoyo"},{"day":7,"private_action":"Revisión final","evidence_boundary":"Acciones externas desactivadas","review_checkpoint":"Confirmar límite","observable_signal":"Límite explícito","fallback":"Mantener privado","stop_rule":"Detener antes de acción no autorizada"}],
  "decision_ladder":[{"branch":"advance","trigger":"Contexto confirmado","evidence_requirement":"Una señal acotada","next_safe_action":"Continuar privado","blocked_action":"Contacto externo","measurement_label":"señal apoyada","review_question":"¿Qué cambió?","script_boundary":"Resumen factual"},{"branch":"clarify","trigger":"Falta contexto","evidence_requirement":"Pendiente nombrado","next_safe_action":"Registrar aclaración","blocked_action":"Suponer contexto","measurement_label":"pregunta abierta","review_question":"¿Qué confirmar?","script_boundary":"Pregunta acotada"},{"branch":"pause","trigger":"Señal débil","evidence_requirement":"Sin cambio útil","next_safe_action":"Esperar revisión","blocked_action":"Predecir","measurement_label":"señal débil","review_question":"¿Es más seguro esperar?","script_boundary":"Sin urgencia artificial"},{"branch":"stop","trigger":"Falla límite","evidence_requirement":"Restricción registrada","next_safe_action":"Cerrar revisión","blocked_action":"Proceder externamente","measurement_label":"condición de parada","review_question":"¿Qué límite falló?","script_boundary":"Sin acción externa"}],
  "daily_reviews":[{"day":1,"observed_signal":"Contexto revisado","signal_quality":"strong","decision":"advance","evidence_log":"Apoyo acotado","next_safe_action":"Continuar privado","metric_label":"claridad","confounder_note":"Sin resultado externo","coach_question":"¿Qué falta?"},{"day":2,"observed_signal":"Evidencia elegida","signal_quality":"strong","decision":"advance","evidence_log":"Punto apoyado","next_safe_action":"Ensayar","metric_label":"evidencia","confounder_note":"No valida resultado","coach_question":"¿Qué la apoya?"},{"day":3,"observed_signal":"Respuesta ensayada","signal_quality":"mixed","decision":"clarify","evidence_log":"Estructura usable","next_safe_action":"Revisar límite","metric_label":"claridad","confounder_note":"No es entrevista","coach_question":"¿Qué es seguro?"},{"day":4,"observed_signal":"Límites revisados","signal_quality":"unknown","decision":"clarify","evidence_log":"Hay confirmaciones","next_safe_action":"Visibilizar pendientes","metric_label":"restricciones","confounder_note":"Desconocido no es fallo","coach_question":"¿Qué confirmar?"},{"day":5,"observed_signal":"Pregunta lista","signal_quality":"strong","decision":"advance","evidence_log":"Pregunta acotada","next_safe_action":"Revisar privado","metric_label":"pregunta","confounder_note":"No crea mensaje","coach_question":"¿Es útil?"},{"day":6,"observed_signal":"Rama revisada","signal_quality":"mixed","decision":"pause","evidence_log":"No requiere movimiento","next_safe_action":"Esperar","metric_label":"decisión","confounder_note":"Sin probabilidad","coach_question":"¿Qué evidencia hay?"},{"day":7,"observed_signal":"Revisión final","signal_quality":"strong","decision":"advance","evidence_log":"Límite intacto","next_safe_action":"Mantener acciones desactivadas","metric_label":"integridad","confounder_note":"No autoriza acción","coach_question":"¿Límite intacto?"}],
  "approval_boundary":{"artifact_state":"private_draft","allowed_next_step":"manual_private_review","prohibited_actions":["message","connect","apply","schedule","calendar_create","publish","share","upload","submit","export","external_edit","purchase","enroll"],"authorization_required":true},
  "delivery":{"draft_only":true,"external_actions_authorized":false,"no_message_action":true,"no_calendar_action":true,"raw_event_retained":false,"raw_reply_retained":false,"raw_answer_retained":false,"local_save_mode":"disabled","candidate_review_required":true}
}
